STIG ID,Version,Rule Title,Title,Severity,Check Text,Fix Text,CCI
57533,SRG-APP-000439-AS-000155,The application server must protect the confidentiality and integrity of transmitted information through the use of an approved TLS version.,SRG-APP-000439-AS-000155,medium,"Review the application server documentation and deployed configuration to determine which version of TLS is being used.If the application server is not using TLS to maintain the confidentiality and integrity of transmitted information or non-FIPS-approved SSL versions are enabled, this is a finding.",Configure the application server to use a FIPS-2 approved TLS version to maintain the confidentiality and integrity of transmitted information and to disable all non-FIPS-approved SSL versions.,CCI-002418
57535,SRG-APP-000440-AS-000167,The application server must employ approved cryptographic mechanisms to prevent unauthorized disclosure of information and/or detect changes to information during transmission.,SRG-APP-000440-AS-000167,medium,"Review application server documentation and configuration to determine if the application server employs approved cryptographic mechanisms to prevent unauthorized disclosure of information and/or detect changes to information during transmission.If the application server does not employ approved cryptographic mechanisms, this is a finding.",Configure the application server to use AES 128 or AES 256 encryption for data in transit.,CCI-002421
57537,SRG-APP-000441-AS-000258,The application server must maintain the confidentiality and integrity of information during preparation for transmission.,SRG-APP-000441-AS-000258,medium,"Review the application server documentation and deployed configuration to determine if the application server maintains the confidentiality and integrity of information during preparation before transmission.If the confidentiality and integrity is not maintained, this is a finding.",Configure the application server to maintain the confidentiality and integrity of information during preparation for transmission.,CCI-002420
57539,SRG-APP-000442-AS-000259,The application server must maintain the confidentiality and integrity of information during reception.,SRG-APP-000442-AS-000259,medium,"Review application server configuration to determine if the server is using a transmission method that maintains the confidentiality and integrity of information during reception.If a transmission method is not being used that maintains the confidentiality and integrity of the data during reception, this is a finding.",Configure the application server to utilize a transmission method that maintains the confidentiality and integrity of information during reception.,CCI-002422
57541,SRG-APP-000416-AS-000140,"The application server must implement NSA-approved cryptography to protect classified information in accordance with applicable federal laws, Executive Orders, directives, policies, regulations, and standards.",SRG-APP-000416-AS-000140,medium,"Review application server documentation to verify that the application server is using NSA-approved cryptography to protect classified data and applications resident on the device.If the application server is not using NSA-approved cryptography for classified data and applications, this is a finding.",Configure the application server to utilize NSA-approved cryptography to protect classified information.,CCI-002450
57543,SRG-APP-000514-AS-000136,Application servers must use NIST-approved or NSA-approved key management technology and processes.,SRG-APP-000514-AS-000136,medium,"Review application server configuration and the NIST FIPS certificate to validate the application server uses NIST-approved or NSA-approved key management technology and processes when producing, controlling or distributing symmetric and asymmetric keys.If the application server does not use this NIST-approved or NSA-approved key management technology and processes, this is a finding.","Configure the application server to utilize NIST-approved or NSA-approved key management technology when the application server produces, controls, and distributes symmetric and asymmetric cryptographic keys.",CCI-002450
57545,SRG-APP-000514-AS-000137,The application server must use DoD- or CNSS-approved PKI Class 3 or Class 4 certificates.,SRG-APP-000514-AS-000137,medium,"Review the application server configuration to determine if the application server utilizes approved PKI Class 3 or Class 4 certificates.If the application server is not configured to use approved DoD or CNS certificates, this is a finding.",Configure the application server to use DoD- or CNSS-approved Class 3 or Class 4 PKI certificates.,CCI-002450
57547,SRG-APP-000206-AS-000145,The application server must identify prohibited mobile code.,SRG-APP-000206-AS-000145,medium,"Review the application server configuration to determine if the application server is configured to identify prohibited mobile code.If the application server is not configured to identify prohibited mobile code, this is a finding.",Configure the application server to identify prohibited mobile code.,CCI-001166
57549,SRG-APP-000223-AS-000150,The application server must generate a unique session identifier for each session.,SRG-APP-000223-AS-000150,medium,"Review the application server configuration to determine if the application server generates a unique session identifier for each session.Request an administrator log onto the server and view the logs to verify a unique session identifier was assigned to the session.If the application server does not generate a unique session identifier for each session, this is a finding.",Configure the application server to generate a unique session identifier for each session.,CCI-001664
57551,SRG-APP-000427-AS-000264,The application server must only allow the use of DoD PKI-established certificate authorities for verification of the establishment of protected sessions.,SRG-APP-000427-AS-000264,medium,"Review the application server documentation and configuration to determine if the application server only allows the use of DoD PKI-established certificate authorities.If the application server allows other certificate authorities for verification, this is a finding.",Configure the application server to allow the use of DoD PKI-established certificate authorities for verification of the establishment of protected sessions.,CCI-002470
57553,SRG-APP-000225-AS-000166,"The application server must fail to a secure state if system initialization fails, shutdown fails, or aborts fail.",SRG-APP-000225-AS-000166,medium,"Review application server documentation and configuration to determine if the application server fails to a secure state if system initialization fails, shutdown fails, or aborts fail.If the application server cannot be configured to fail securely, this is a finding.","Configure the application server to fail to a secure state if system initialization fails, shutdown fails, or aborts fail.",CCI-001190
57555,SRG-APP-000231-AS-000133,The application server must protect the confidentiality and integrity of all information at rest.,SRG-APP-000231-AS-000133,medium,"Review the application server documentation and configuration to ensure the application server is protecting the confidentiality and integrity of all information at rest.If the confidentiality and integrity of all information at rest is not protected, this is a finding.",Configure the application server to protect the confidentiality and integrity of all information at rest.,CCI-001199
57557,SRG-APP-000428-AS-000265,The application server must implement cryptographic mechanisms to prevent unauthorized modification of organization-defined information at rest on organization-defined information system components.,SRG-APP-000428-AS-000265,medium,"Review application server documentation and configuration to determine if the application server implements cryptographic mechanisms to prevent unauthorized modification of organization-defined information at rest on organization-defined information system components.If the application server does not implement cryptographic mechanisms to prevent unauthorized modification, this is a finding.",Configure the application server to implement cryptographic mechanisms to prevent unauthorized modification of organization-defined information at rest on organization-defined information system components.,CCI-002475
57559,SRG-APP-000429-AS-000157,The application must implement cryptographic mechanisms to prevent unauthorized disclosure of organization-defined information at rest on organization-defined information system components.,SRG-APP-000429-AS-000157,medium,"Review application server documentation and configuration to determine if the application server implements cryptographic mechanisms to prevent unauthorized disclosure of organization-defined information at rest on organization-defined information system components.If the application server does not implement cryptographic mechanisms to prevent unauthorized disclosure, this is a finding.",Configure the application server to implement cryptographic mechanisms to prevent unauthorized disclosure of organization-defined information at rest on organization-defined information system components.,CCI-002476
57561,SRG-APP-000456-AS-000266,"The application server must install security-relevant software updates within the time period directed by an authoritative source (e.g. IAVM, CTOs, DTMs, and STIGs).",SRG-APP-000456-AS-000266,medium,"Review the application server documentation and configuration to determine if the application server checks with a patch management system to install security-relevant software updates within a timeframe directed by an authoritative source.If the application server does not install security-relevant patches within the time period directed by the authoritative source, this is a finding.",Configure the application server to use a patch management system to ensure security-relevant updates are installed within the time period directed by the authoritative source.,CCI-002605
57563,SRG-APP-000454-AS-000268,The application server must remove organization-defined software components after updated versions have been installed.,SRG-APP-000454-AS-000268,medium,"Review the application server documentation and configuration to determine if organization-defined software components are removed after updated versions have been installed.If organization-defined software components are not removed after updated versions have been installed, this is a finding.",Configure the application server to remove organization-defined software components after updated versions have been installed.,CCI-002617
57565,SRG-APP-000447-AS-000273,The application server must behave in a predictable and documented manner that reflects organizational and system objectives when invalid inputs are received.,SRG-APP-000447-AS-000273,medium,"Review the application server configuration to determine if the management interface behaves in a predictable and documented manner that reflects organizational and system objectives when invalid inputs are received.If the application server does not meet this requirement, this is a finding.",Configure the application server management interface to behave in a predictable and documented manner that reflects organizational and system objectives when invalid inputs are received.,CCI-002754
57567,SRG-APP-000266-AS-000168,The application server must identify potentially security-relevant error conditions.,SRG-APP-000266-AS-000168,medium,"Review the application server configuration to determine if the system identifies potentially security-relevant error conditions on the server.If this function is not performed, this is a finding.",Configure the application server to identify potentially security-relevant error conditions on the server.,CCI-001312
61351,SRG-APP-000439-AS-000274 ,The application server must remove all export ciphers to protect the confidentiality and integrity of transmitted information.,SRG-APP-000439-AS-000274 ,medium,"Review the application server documentation and deployed configuration to determine if export ciphers are removed.If the application server does not have the export ciphers removed, this is a finding.",Configure the application server to have export ciphers removed.,CCI-002418
